document_id,title,abstract,clean_text,label,year
e9f980a533175160f56550308432451b592d5bc3,Is YouTube a reliable source of health-related information? A systematic review,"Background YouTube is a valuable source of health-related educational material which can have a profound impact on people’s behaviors and decisions. However, YouTube contains a wide variety of unverified content that may promote unhealthy behaviors and activities. We aim in this systematic review to provide insight into the published literature concerning the quality of health information and educational videos found on YouTube. Methods We searched Google Scholar, Medline (through PubMed), EMBASE, Scopus, Direct Science, Web of Science, and ProQuest databases to find all papers on the analysis of medical and health-related content published in English up to August 2020. Based on eligibility criteria, 202 papers were included in our study. We reviewed every article and extracted relevant data such as the number of videos and assessors, the number and type of quality categories, and the recommendations made by the authors. The extracted data from the papers were aggregated using different methods to compile the results. Results The total number of videos assessed in the selected articles is 22,300 (median = 94, interquartile range = 50.5–133). The videos were evaluated by one or multiple assessors (median = 2, interquartile range = 1–3). The video quality was assessed by scoring, categorization, or based on creators’ bias. Researchers commonly employed scoring systems that are either standardized (e.g., GQS, DISCERN, and JAMA) or based upon the guidelines and recommendations of professional associations. Results from the aggregation of scoring or categorization data indicate that health-related content on YouTube is of average to below-average quality. The compiled results from bias-based classification show that only 32% of the videos appear neutral toward the health content. Furthermore, the majority of the studies confirmed either negative or no correlation between the quality and popularity of the assessed videos. Conclusions YouTube is not a reliable source of medical and health-related information. YouTube’s popularity-driven metrics such as the number of views and likes should not be considered quality indicators. YouTube should improve its ranking and recommender system to promote higher-quality content. One way is to consider expert reviews of medical and health-related videos and to include their assessment data in the ranking algorithm.",background youtube valuable source health relate educational material profound impact people behavior decision however youtube contain wide variety unverified content may promote unhealthy behavior activity aim systematic review provide insight publish literature concern quality health information educational video find youtube method search google scholar medline pubmed embase scopus direct science web science proquest database find paper analysis medical health relate content publish english august base eligibility criterion paper include study review every article extract relevant data number video assessor number type quality category recommendation make author extract data paper aggregate use different method compile result result total number video assess select article median interquartile range video evaluate one multiple assessor median interquartile range video quality assess score categorization base creator bias researcher commonly employ score system either standardize e g gqs discern jama base upon guideline recommendation professional association result aggregation score categorization data indicate health relate content youtube average average quality compile result bias base classification show video appear neutral toward health content furthermore majority study confirm either negative correlation quality popularity assess video conclusion youtube reliable source medical health relate information youtube popularity drive metric number view like consider quality indicator youtube improve rank recommender system promote higher quality content one way consider expert review medical health relate video include assessment data rank algorithm,survey_review,2021
55db88084fa81f8ba3820ea800eae38a4a9dcc46,Factors Influencing Adherence to mHealth Apps for Prevention or Management of Noncommunicable Diseases: Systematic Review,"Background Mobile health (mHealth) apps show vast potential in supporting patients and health care systems with the increasing prevalence and economic costs of noncommunicable diseases (NCDs) worldwide. However, despite the availability of evidence-based mHealth apps, a substantial proportion of users do not adhere to them as intended and may consequently not receive treatment. Therefore, understanding the factors that act as barriers to or facilitators of adherence is a fundamental concern in preventing intervention dropouts and increasing the effectiveness of digital health interventions. Objective This review aimed to help stakeholders develop more effective digital health interventions by identifying factors influencing the continued use of mHealth apps targeting NCDs. We further derived quantified adherence scores for various health domains to validate the qualitative findings and explore adherence benchmarks. Methods A comprehensive systematic literature search (January 2007 to December 2020) was conducted on MEDLINE, Embase, Web of Science, Scopus, and ACM Digital Library. Data on intended use, actual use, and factors influencing adherence were extracted. Intervention-related and patient-related factors with a positive or negative influence on adherence are presented separately for the health domains of NCD self-management, mental health, substance use, nutrition, physical activity, weight loss, multicomponent lifestyle interventions, mindfulness, and other NCDs. Quantified adherence measures, calculated as the ratio between the estimated intended use and actual use, were derived for each study and compared with the qualitative findings. Results The literature search yielded 2862 potentially relevant articles, of which 99 (3.46%) were included as part of the inclusion criteria. A total of 4 intervention-related factors indicated positive effects on adherence across all health domains: personalization or tailoring of the content of mHealth apps to the individual needs of the user, reminders in the form of individualized push notifications, user-friendly and technically stable app design, and personal support complementary to the digital intervention. Social and gamification features were also identified as drivers of app adherence across several health domains. A wide variety of patient-related factors such as user characteristics or recruitment channels further affects adherence. The derived adherence scores of the included mHealth apps averaged 56.0% (SD 24.4%). Conclusions This study contributes to the scarce scientific evidence on factors that positively or negatively influence adherence to mHealth apps and is the first to quantitatively compare adherence relative to the intended use of various health domains. As underlying studies mostly have a pilot character with short study durations, research on factors influencing adherence to mHealth apps is still limited. To facilitate future research on mHealth app adherence, researchers should clearly outline and justify the app’s intended use; report objective data on actual use relative to the intended use; and, ideally, provide long-term use and retention data.",background mobile health mhealth apps show vast potential support patient health care system increase prevalence economic cost noncommunicable disease ncds worldwide however despite availability evidence base mhealth apps substantial proportion user adhere intend may consequently receive treatment therefore understand factor act barrier facilitator adherence fundamental concern prevent intervention dropout increase effectiveness digital health intervention objective review aim help stakeholder develop effective digital health intervention identify factor influence continue use mhealth apps target ncds derive quantify adherence score various health domain validate qualitative find explore adherence benchmark method comprehensive systematic literature search january december conduct medline embase web science scopus acm digital library data intend use actual use factor influence adherence extract intervention relate patient relate factor positive negative influence adherence present separately health domain ncd self management mental health substance use nutrition physical activity weight loss multicomponent lifestyle intervention mindfulness ncds quantify adherence measure calculate ratio estimate intend use actual use derive study compare qualitative find result literature search yield potentially relevant article include part inclusion criterion total intervention relate factor indicate positive effect adherence across health domain personalization tailor content mhealth apps individual need user reminder form individualize push notification user friendly technically stable app design personal support complementary digital intervention social gamification feature also identify driver app adherence across several health domain wide variety patient relate factor user characteristic recruitment channel affect adherence derive adherence score include mhealth apps average sd conclusion study contribute scarce scientific evidence factor positively negatively influence adherence mhealth apps first quantitatively compare adherence relative intend use various health domain underlie study mostly pilot character short study duration research factor influence adherence mhealth apps still limit facilitate future research mhealth app adherence researcher clearly outline justify app intend use report objective data actual use relative intend use ideally provide long term use retention data,survey_review,2021
fd0ad6f2b9832fc11b3a62ddddeac9ff2aed145d,"Global prevalence of cleft palate, cleft lip and cleft palate and lip: A comprehensive systematic review and meta-analysis.","BACKGROUND
Birth defect is widely used as a term for congenital anomalies. Children with cleft lip and palate may have serious speech, hearing, nutrition, and mental and social development disorders; therefore, this study was designed to determine the overall prevalence of cleft palate, lip, and cleft palate through systematic review and meta-analysis.


METHODS
In this study, systematic review and meta-analysis of data from studies on the prevalence of cleft lip and palate in Scopus, Embase, Magiran, Web of Science (WoS), PubMed and Science Direct databases were extracted between January 2000 and June 2020. In order to perform the analysis of qualified studies, the model of random effects was used and the inconsistency of studies with I2 index was investigated. Data analysis was performed with Comprehensive Meta-Analysis software (Version 2).


RESULTS
According to the results of the present study on cleft palate, the total number of samples entered in the study in 59 studies were 21088517 individuals, the prevalence of cleft palate based on the meta-analysis of the reviewed studies in every 1000 live births was obtained 0.33 (95% CI: 0.28-0.38). In the case of cleft lip, the total number of samples entered in the 57 reviewed studies were 17,907,569 individuals. The prevalence of cleft lip obtained based on the meta-analysis of the reviewed studies was 0.3 in every 1000 live births (95% CI: 0.26-0.34), and in the case of cleft lip and palate, the total number of samples entered in the 55 reviewed studies was 17894673. The prevalence of cleft lip and palate based on the meta-analysis of the studies reviewed in each 1000 live births was 0.45 (95% CI: 0.38-0.52).


CONCLUSION
Due to the high prevalence of oral clefts such as cleft palate, cleft lip, and cleft lip and palate; health system policymakers need to take precautionary measures to reduce the number of patients, as well as diagnostic and therapeutic measures to reduce the effects of this disorder in children.",background birth defect widely use term congenital anomaly child cleave lip palate may serious speech hear nutrition mental social development disorder therefore study design determine overall prevalence cleave palate lip cleave palate systematic review meta analysis method study systematic review meta analysis data study prevalence cleave lip palate scopus embase magiran web science wos pubmed science direct database extract january june order perform analysis qualify study model random effect use inconsistency study index investigate data analysis perform comprehensive meta analysis software version result accord result present study cleave palate total number sample enter study study individual prevalence cleave palate base meta analysis review study every live birth obtain ci case cleave lip total number sample enter review study individual prevalence cleave lip obtain base meta analysis review study every live birth ci case cleave lip palate total number sample enter review study prevalence cleave lip palate base meta analysis study review live birth ci conclusion due high prevalence oral cleave cleave palate cleave lip cleave lip palate health system policymakers need take precautionary measure reduce number patient well diagnostic therapeutic measure reduce effect disorder child,survey_review,2021
3559cca77d6c3d4aa213d1674f72146e85aa1eaf,The prevalence of compassion satisfaction and compassion fatigue among nurses: A systematic review and meta-analysis.,"BACKGROUND
Compassion fatigue is a consequence of chronic work-related stress exposure among healthcare providers. Nursing is a high-risk, stressful profession which increases nurses' vulnerability to compassion fatigue symptoms compared to other healthcare workers. Compassion fatigue has serious consequences for nursing staff, patients and healthcare organizations. Though several studies on the prevalence of compassion fatigue among nurses have been published, the reported data vary considerably across studies; and few meta-analysis have examined the prevalence of compassion satisfaction and compassion fatigue among nurses with large sample sizes.


OBJECTIVES
To systematically assess the prevalence of compassion satisfaction and compassion fatigue among nurses, and to evaluate the effect of different geographical regions, years and departments on the prevalence of compassion fatigue.


DESIGN
Systematic review and meta-analysis DATA SOURCES: The Cochrane Library, PubMed, EMbase, Web of Science, CINAHL, PsyclNFO, China Knowledge Resource Integrated Database (CNKI), Wanfang Database, Weipu Database (VIP), and Chinese Biomedical Database (CBM) were searched in the systematic review. The time frame for the searches included all literature before January 31st, 2020.


REVIEW METHODS
The reviewers independently completed study selection, quality assessments, data extraction and analysis of all included literature. The mean scores and standard deviations of the three subscales of the Professional Quality of Life (ProQOL) scale were pooled using random effects meta-analysis in Stata 16.0 software package. Finally, subgroup analyses were conducted to explore the sources of between-study heterogeneity.


RESULTS
A total of 79 studies were included in the systematic review and meta-analysis, consisting of 28,509 nurses worldwide from 11 countries. In our studies, the pooled mean scores of compassion satisfaction, burnout and secondary traumatic stress were 33.12 (95% CI: 32.22-34.03), 26.64 (95% CI: 26.01-27.27) and 25.24 (95% CI: 24.69-25.79), respectively. In addition, the Asian region had the lowest levels of compassion satisfaction but the highest levels of compassion fatigue symptoms, while the Americas and Europe had the lowest levels of compassion fatigue but highest compassion satisfaction. Levels of compassionate fatigue in nurses increased gradually from 2010 to 2019, reaching the highest level in 2019; and nurses from ICU had the highest levels of compassion fatigue symptoms among all nurses.


CONCLUSION
The levels of compassion satisfaction and compassion fatigue among nurses are moderate. Nurses from the Asian region and in ICUs suffer from severe compassion fatigue symptoms, and the prevalence of compassion fatigue has increased over time. These findings may provide hospital administrators with the theoretical basis for the management and treatment of compassion fatigue.


REGISTRATION NUMBER
PROSPERO [CRD42020164327].",background compassion fatigue consequence chronic work relate stress exposure among healthcare provider nurse high risk stressful profession increase nurse vulnerability compassion fatigue symptom compare healthcare worker compassion fatigue serious consequence nurse staff patient healthcare organization though several study prevalence compassion fatigue among nurse publish report data vary considerably across study meta analysis examine prevalence compassion satisfaction compassion fatigue among nurse large sample size objective systematically assess prevalence compassion satisfaction compassion fatigue among nurse evaluate effect different geographical region year department prevalence compassion fatigue design systematic review meta analysis data source cochrane library pubmed embase web science cinahl psyclnfo china knowledge resource integrate database cnki wanfang database weipu database vip chinese biomedical database cbm search systematic review time frame search include literature january st review method reviewer independently complete study selection quality assessment data extraction analysis include literature mean score standard deviation three subscales professional quality life proqol scale pool use random effect meta analysis stata software package finally subgroup analysis conduct explore source study heterogeneity result total study include systematic review meta analysis consist nurse worldwide country study pool mean score compassion satisfaction burnout secondary traumatic stress ci ci ci respectively addition asian region lowest level compassion satisfaction highest level compassion fatigue symptom america europe lowest level compassion fatigue highest compassion satisfaction level compassionate fatigue nurse increase gradually reach highest level nurse icu highest level compassion fatigue symptom among nurse conclusion level compassion satisfaction compassion fatigue among nurse moderate nurse asian region icu suffer severe compassion fatigue symptom prevalence compassion fatigue increase time find may provide hospital administrator theoretical basis management treatment compassion fatigue registration number prospero crd,survey_review,2021
e96957bb5222039a2a95c252fd3cf34e4909b982,Greenspace and human health: An umbrella review,"Multiple systematic reviews on greenspace and health outcomes exist, but the overall evidence base remains unclear. Therefore, we performed an umbrella review to collect and appraise all relevant systematic reviews of epidemiological studies on greenness exposure and health. We searched PubMed, Embase, and Web of Science from inception to June 28, 2021, and screened references of relevant articles. Systematic reviews with or without meta-analyses of epidemiological studies that examined the associations of greenness with any health outcome were included. Two independent investigators performed study selection and data extraction. We also evaluated the methodological quality of the included systematic reviews using the “Assessing the Methodological Quality of Systematic Reviews 2” checklist. A total of 40 systematic reviews and meta-analyses were included, of which most were cross-sectional studies conducted in high-income countries. Greenspace exposure was estimated with various objective and subjective parameters. Beneficial associations of greenspace with all-cause and stroke-specific mortality, CVD morbidity, cardiometabolic factors, mental health, low birth weight, physical activity, sleep quality, and urban crime were observed. No consistent associations between greenspace and other health outcomes (e.g., cancers) were observed. Most of the included systematic reviews and meta-analyses had one or more limitations in methodology. Our findings provide supportive evidence regarding the beneficial effects of greenspace exposure on some aspects of human health. However, the credibility of such evidence was compromised by methodological limitations. Better performed systematic reviews and meta-analyses as well as longitudinal designed primary studies are needed to validate this conclusion.",multiple systematic review greenspace health outcome exist overall evidence base remain unclear therefore perform umbrella review collect appraise relevant systematic review epidemiological study greenness exposure health search pubmed embase web science inception june screen reference relevant article systematic review without meta analysis epidemiological study examine association greenness health outcome include two independent investigator perform study selection data extraction also evaluate methodological quality include systematic review use assess methodological quality systematic review checklist total systematic review meta analysis include cross sectional study conduct high income country greenspace exposure estimate various objective subjective parameter beneficial association greenspace cause stroke specific mortality cvd morbidity cardiometabolic factor mental health low birth weight physical activity sleep quality urban crime observe consistent association greenspace health outcome e g cancer observe include systematic review meta analysis one limitation methodology find provide supportive evidence regard beneficial effect greenspace exposure aspect human health however credibility evidence compromise methodological limitation better perform systematic review meta analysis well longitudinal design primary study need validate conclusion,survey_review,2021
