document_id,title,abstract,clean_text,label,year
9e97913941d6df5b4e187cee5a1e284be39c354f,"Neurological Manifestations of Hospitalized Patients with COVID-19 in Wuhan, China: a retrospective case series study","OBJECTIVE: To study the neurological manifestations of patients with coronavirus disease 2019 (COVID-19). DESIGN: Retrospective case series SETTING: Three designated COVID-19 care hospitals of the Union Hospital of Huazhong University of Science and Technology in Wuhan, China. PARTICIPANTS: Two hundred fourteen hospitalized patients with laboratory confirmed diagnosis of severe acute respiratory syndrome from coronavirus 2 (SARS-CoV-2) infection. Data were collected from 16 January 2020 to 19 February 2020. MAIN OUTCOME MEASURES: Clinical data were extracted from electronic medical records and reviewed by a trained team of physicians. Neurological symptoms fall into three categories: central nervous system (CNS) symptoms or diseases (headache, dizziness, impaired consciousness, ataxia, acute cerebrovascular disease, and epilepsy), peripheral nervous system (PNS) symptoms (hypogeusia, hyposmia, hypopsia, and neuralgia), and skeletal muscular symptoms. Data of all neurological symptoms were checked by two trained neurologists. RESULTS: Of 214 patients studied, 88 (41.1%) were severe and 126 (58.9%) were non-severe patients. Compared with non-severe patients, severe patients were older (58.7 ± 15.0 years vs 48.9 ± 14.7 years), had more underlying disorders (42 [47.7%] vs 41 [32.5%]), especially hypertension (32 [36.4%] vs 19 [15.1%]), and showed less typical symptoms such as fever (40 [45.5%] vs 92 [73%]) and cough (30 [34.1%] vs 77 [61.1%]). Seventy-eight (36.4%) patients had neurologic manifestations. More severe patients were likely to have neurologic symptoms (40 [45.5%] vs 38 [30.2%]), such as acute cerebrovascular diseases (5 [5.7%] vs 1 [0.8%]), impaired consciousness (13 [14.8%] vs 3 [2.4%]) and skeletal muscle injury (17 [19.3%] vs 6 [4.8%]). CONCLUSION: Compared with non-severe patients with COVID-19, severe patients commonly had neurologic symptoms manifested as acute cerebrovascular diseases, consciousness impairment and skeletal muscle symptoms.",objective study neurological manifestation patient coronavirus disease covid design retrospective case series set three designate covid care hospital union hospital huazhong university science technology wuhan china participant two hundred fourteen hospitalize patient laboratory confirm diagnosis severe acute respiratory syndrome coronavirus sars cov infection data collect january february main outcome measure clinical data extract electronic medical record review train team physician neurological symptom fall three category central nervous system cns symptom disease headache dizziness impair consciousness ataxia acute cerebrovascular disease epilepsy peripheral nervous system pns symptom hypogeusia hyposmia hypopsia neuralgia skeletal muscular symptom data neurological symptom check two train neurologist result patient study severe non severe patient compare non severe patient severe patient older year v year underlie disorder v especially hypertension v show less typical symptom fever v cough v seventy eight patient neurologic manifestation severe patient likely neurologic symptom v acute cerebrovascular disease v impair consciousness v skeletal muscle injury v conclusion compare non severe patient covid severe patient commonly neurologic symptom manifest acute cerebrovascular disease consciousness impairment skeletal muscle symptom,applications,2020
6a735afec0f6c190f5157e18cc8ec4164091cb8f,"Clinical features and obstetric and neonatal outcomes of pregnant patients with COVID-19 in Wuhan, China: a retrospective, single-centre, descriptive study","Background In December, 2019, coronavirus disease 2019 (COVID-19) caused by severe acute respiratory syndrome coronavirus 2 (SARS-CoV-2) emerged in Wuhan, China. The number of affected pregnant women is increasing, but scarce information is available about the clinical features of COVID-19 in pregnancy. This study aimed to clarify the clinical features and obstetric and neonatal outcomes of pregnant patients with COVID-19. Methods In this retrospective, single-centre study, we included all pregnant women with COVID-19 who were admitted to Tongji Hospital in Wuhan, China. Clinical features, treatments, and maternal and fetal outcomes were assessed. Findings Seven patients, admitted to Tongji Hospital from Jan 1, to Feb 8, 2020, were included in our study. The mean age of the patients was 32 years (range 29–34 years) and the mean gestational age was 39 weeks plus 1 day (range 37 weeks to 41 weeks plus 2 days). Clinical manifestations were fever (six [86%] patients), cough (one [14%] patient), shortness of breath (one [14%] patient), and diarrhoea (one [14%] patient). All the patients had caesarean section within 3 days of clinical presentation with an average gestational age of 39 weeks plus 2 days. The final date of follow-up was Feb 12, 2020. The outcomes of the pregnant women and neonates were good. Three neonates were tested for SARS-CoV-2 and one neonate was infected with SARS-CoV-2 36 h after birth. Interpretation The maternal, fetal, and neonatal outcomes of patients who were infected in late pregnancy appeared very good, and these outcomes were achieved with intensive, active management that might be the best practice in the absence of more robust data. The clinical characteristics of these patients with COVID-19 during pregnancy were similar to those of non-pregnant adults with COVID-19 that have been reported in the literature. Funding National Natural Science Foundation of China, Hubei Provincial Natural Science Foundation of China.",background december coronavirus disease covid cause severe acute respiratory syndrome coronavirus sars cov emerge wuhan china number affect pregnant woman increase scarce information available clinical feature covid pregnancy study aim clarify clinical feature obstetric neonatal outcome pregnant patient covid method retrospective single centre study include pregnant woman covid admit tongji hospital wuhan china clinical feature treatment maternal fetal outcome assess find seven patient admit tongji hospital jan feb include study mean age patient year range year mean gestational age week plus day range week week plus day clinical manifestation fever six patient cough one patient shortness breath one patient diarrhoea one patient patient caesarean section within day clinical presentation average gestational age week plus day final date follow feb outcome pregnant woman neonate good three neonate test sars cov one neonate infect sars cov h birth interpretation maternal fetal neonatal outcome patient infect late pregnancy appear good outcome achieve intensive active management might best practice absence robust data clinical characteristic patient covid pregnancy similar non pregnant adult covid report literature fund national natural science foundation china hubei provincial natural science foundation china,applications,2020
1a9d0d72a1c3fd1dded67f8fbe2a6d151bae0d71,"Evolving epidemiology and transmission dynamics of coronavirus disease 2019 outside Hubei province, China: a descriptive and modelling study","Background The coronavirus disease 2019 (COVID-19) epidemic, caused by severe acute respiratory syndrome coronavirus 2 (SARS-CoV-2), began in Wuhan city, Hubei province, in December, 2019, and has spread throughout China. Understanding the evolving epidemiology and transmission dynamics of the outbreak beyond Hubei would provide timely information to guide intervention policy. Methods We collected individual information from official public sources on laboratory-confirmed cases reported outside Hubei in mainland China for the period of Jan 19 to Feb 17, 2020. We used the date of the fourth revision of the case definition (Jan 27) to divide the epidemic into two time periods (Dec 24 to Jan 27, and Jan 28 to Feb 17) as the date of symptom onset. We estimated trends in the demographic characteristics of cases and key time-to-event intervals. We used a Bayesian approach to estimate the dynamics of the net reproduction number (Rt) at the provincial level. Findings We collected data on 8579 cases from 30 provinces. The median age of cases was 44 years (33–56), with an increasing proportion of cases in younger age groups and in elderly people (ie, aged >64 years) as the epidemic progressed. The mean time from symptom onset to hospital admission decreased from 4·4 days (95% CI 0·0–14·0) for the period of Dec 24 to Jan 27, to 2·6 days (0·0–9·0) for the period of Jan 28 to Feb 17. The mean incubation period for the entire period was estimated at 5·2 days (1·8–12·4) and the mean serial interval at 5·1 days (1·3–11·6). The epidemic dynamics in provinces outside Hubei were highly variable but consistently included a mixture of case importations and local transmission. We estimated that the epidemic was self-sustained for less than 3 weeks, with mean Rt reaching peaks between 1·08 (95% CI 0·74–1·54) in Shenzhen city of Guangdong province and 1·71 (1·32–2·17) in Shandong province. In all the locations for which we had sufficient data coverage of Rt, Rt was estimated to be below the epidemic threshold (ie, <1) after Jan 30. Interpretation Our estimates of the incubation period and serial interval were similar, suggesting an early peak of infectiousness, with possible transmission before the onset of symptoms. Our results also indicate that, as the epidemic progressed, infectious individuals were isolated more quickly, thus shortening the window of transmission in the community. Overall, our findings indicate that strict containment measures, movement restrictions, and increased awareness of the population might have contributed to interrupt local transmission of SARS-CoV-2 outside Hubei province. Funding National Science Fund for Distinguished Young Scholars, National Institute of General Medical Sciences, and European Commission Horizon 2020.",background coronavirus disease covid epidemic cause severe acute respiratory syndrome coronavirus sars cov begin wuhan city hubei province december spread throughout china understand evolve epidemiology transmission dynamic outbreak beyond hubei would provide timely information guide intervention policy method collect individual information official public source laboratory confirm case report outside hubei mainland china period jan feb use date fourth revision case definition jan divide epidemic two time period dec jan jan feb date symptom onset estimate trend demographic characteristic case key time event interval use bayesian approach estimate dynamic net reproduction number rt provincial level find collect data case province median age case year increase proportion case younger age group elderly people ie age year epidemic progress mean time symptom onset hospital admission decrease day ci period dec jan day period jan feb mean incubation period entire period estimate day mean serial interval day epidemic dynamic province outside hubei highly variable consistently include mixture case importation local transmission estimate epidemic self sustain less week mean rt reach peak ci shenzhen city guangdong province shandong province location sufficient data coverage rt rt estimate epidemic threshold ie jan interpretation estimate incubation period serial interval similar suggest early peak infectiousness possible transmission onset symptom result also indicate epidemic progress infectious individual isolate quickly thus shorten window transmission community overall find indicate strict containment measure movement restriction increase awareness population might contribute interrupt local transmission sars cov outside hubei province fund national science fund distinguish young scholar national institute general medical science european commission horizon,applications,2020
dab85d00ab9d6df536d31df970510ceaed99b7c3,Viral epitope profiling of COVID-19 patients reveals cross-reactivity and correlates of severity,"Profiling coronaviruses Among the coronaviruses that infect humans, four cause mild common colds, whereas three others, including the currently circulating severe acute respiratory syndrome coronavirus 2 (SARS-CoV-2), result in severe infections. Shrock et al. used a technology known as VirScan to probe the antibody repertoires of hundreds of coronavirus disease 2019 (COVID-19) patients and pre–COVID-19 era controls. They identified hundreds of antibody targets, including several antibody epitopes shared by the mild and severe coronaviruses and many specific to SARS-CoV-2. A machine-learning model accurately classified patients infected with SARS-CoV-2 and guided the design of an assay for rapid SARS-CoV-2 antibody detection. The study also looked at how the antibody response and viral exposure history differ in patients with diverging outcomes, which could inform the production of improved vaccine and antibody therapies. Science, this issue p. eabd4250 Deep serological profiling reveals discriminatory epitopes that could be used for SARS-CoV-2 antibody detection. INTRODUCTION A systematic characterization of the humoral response to severe acute respiratory system coronavirus 2 (SARS-CoV-2) epitopes has yet to be performed. This analysis is important for understanding the immunogenicity of the viral proteome and the basis for cross-reactivity with the common-cold coronaviruses. Coronavirus disease 2019 (COVID-19), caused by SARS-CoV-2, is notable for its variable course, with some individuals remaining asymptomatic whereas others experience fever, respiratory distress, or even death. A comprehensive investigation of the antibody response in individuals with severe versus mild COVID-19—as well as an examination of past viral exposure history—is needed. RATIONALE An understanding of humoral responses to SARS-CoV-2 is critical for improving diagnostics and vaccines and gaining insight into variable clinical outcomes. To this end, we used VirScan, a high-throughput method to analyze epitopes of antiviral antibodies in human sera. We supplemented the original VirScan library with additional libraries of peptides spanning the proteomes of SARS-CoV-2 and all other human coronaviruses. These libraries enabled us to precisely map epitope locations and investigate cross-reactivity between SARS-CoV-2 and other coronavirus strains. The original VirScan library allowed us to simultaneously investigate antibody responses to prior infections and viral exposure history. RESULTS We screened sera from 232 COVID-19 patients and 190 pre–COVID-19 era controls against the original VirScan and supplemental coronavirus libraries, assaying more than 108 antibody repertoire–peptide interactions. We identified epitopes ranging from “private” (recognized by antibodies in only a small number of individuals) to “public” (recognized by antibodies in many individuals) and detected SARS-CoV-2–specific epitopes as well as those that cross-react with common-cold coronaviruses. Several of these cross-reacting antibodies are present in pre–COVID-19 era samples. We developed a machine learning model that predicted SARS-CoV-2 exposure history with 99% sensitivity and 98% specificity from VirScan data. We used the most discriminatory SARS-CoV-2 peptides to produce a Luminex-based serological assay, which performed similarly to gold-standard enzyme-linked immunosorbent assays. We stratified the COVID-19 patient samples by disease severity and found that patients who had required hospitalization exhibited stronger and broader antibody responses to SARS-CoV-2 but weaker overall responses to past infections compared with those who did not need hospitalization. Further, the hospitalized group had higher seroprevalence rates for cytomegalovirus and herpes simplex virus 1. These findings may be influenced by differences in demographic compositions between the two groups, but they raise hypotheses that may be tested in future studies. Using alanine scanning mutagenesis, we precisely mapped 823 distinct epitopes across the entire SARS-CoV-2 proteome, 10 of which are likely targets of neutralizing antibodies. One cross-reactive antibody epitope in S2 has been previously suggested to be neutralizing and, as it exists in pre–COVID-19 era samples, could affect the severity of COVID-19. CONCLUSION We present a highly detailed view of the epitope landscape within the SARS-CoV-2 proteome. This knowledge may be used to produce diagnostics with improved specificity and can provide a stepping stone to the isolation and functional dissection of both neutralizing antibodies and antibodies that might exacerbate patient outcomes through antibody-dependent enhancement or immune distraction. Our study reveals notable correlations between COVID-19 severity and both viral exposure history and overall strength of the antibody response to past infections. These findings are likely influenced by demographic covariates, but they generate hypotheses that may be tested with larger patient cohorts matched for age, gender, race, and other demographic variables. SARS-CoV-2 epitope mapping. VirScan detects antibodies against SARS-CoV-2 in COVID-19 patients with severe and mild disease. Heatmap color represents the strength of the antibody response in each sample (columns) to each protein (rows, left) or peptide (rows, right). VirScan reveals the precise positions of epitopes, which can be mapped onto the structure of the spike protein (S). Examination of SARS-CoV-2 and seasonal coronavirus sequence conservation explains epitope cross-reactivity. A, Ala; D, Asp; E, Glu; F, Phe; I, Ile; K, Lys; L, Leu; N, Asn; P, Pro; Q, Gln; R, Arg; S, Ser; T, Thr; V, Val; W, Trp; Y, Tyr. Understanding humoral responses to severe acute respiratory syndrome coronavirus 2 (SARS-CoV-2) is critical for improving diagnostics, therapeutics, and vaccines. Deep serological profiling of 232 coronavirus disease 2019 (COVID-19) patients and 190 pre–COVID-19 era controls using VirScan revealed more than 800 epitopes in the SARS-CoV-2 proteome, including 10 epitopes likely recognized by neutralizing antibodies. Preexisting antibodies in controls recognized SARS-CoV-2 ORF1, whereas only COVID-19 patient antibodies primarily recognized spike protein and nucleoprotein. A machine learning model trained on VirScan data predicted SARS-CoV-2 exposure history with 99% sensitivity and 98% specificity; a rapid Luminex-based diagnostic was developed from the most discriminatory SARS-CoV-2 peptides. Individuals with more severe COVID-19 exhibited stronger and broader SARS-CoV-2 responses, weaker antibody responses to prior infections, and higher incidence of cytomegalovirus and herpes simplex virus 1, possibly influenced by demographic covariates. Among hospitalized patients, males produce stronger SARS-CoV-2 antibody responses than females.",profile coronaviruses among coronaviruses infect human four cause mild common cold whereas three others include currently circulate severe acute respiratory syndrome coronavirus sars cov result severe infection shrock et al use technology know virscan probe antibody repertoire hundred coronavirus disease covid patient pre covid era control identify hundred antibody target include several antibody epitope share mild severe coronaviruses many specific sars cov machine learn model accurately classify patient infect sars cov guide design assay rapid sars cov antibody detection study also look antibody response viral exposure history differ patient diverge outcome could inform production improve vaccine antibody therapy science issue p eabd deep serological profile reveal discriminatory epitope could use sars cov antibody detection introduction systematic characterization humoral response severe acute respiratory system coronavirus sars cov epitope yet perform analysis important understand immunogenicity viral proteome basis cross reactivity common cold coronaviruses coronavirus disease covid cause sars cov notable variable course individual remain asymptomatic whereas others experience fever respiratory distress even death comprehensive investigation antibody response individual severe versus mild covid well examination past viral exposure history need rationale understand humoral response sars cov critical improve diagnostics vaccine gain insight variable clinical outcome end use virscan high throughput method analyze epitope antiviral antibody human serum supplement original virscan library additional library peptide span proteome sars cov human coronaviruses library enable u precisely map epitope location investigate cross reactivity sars cov coronavirus strain original virscan library allow u simultaneously investigate antibody response prior infection viral exposure history result screen serum covid patient pre covid era control original virscan supplemental coronavirus library assay antibody repertoire peptide interaction identify epitope range private recognize antibody small number individual public recognize antibody many individual detect sars cov specific epitope well cross react common cold coronaviruses several cross react antibody present pre covid era sample develop machine learn model predict sars cov exposure history sensitivity specificity virscan data use discriminatory sars cov peptide produce luminex base serological assay perform similarly gold standard enzyme link immunosorbent assay stratify covid patient sample disease severity find patient require hospitalization exhibit stronger broader antibody response sars cov weaker overall response past infection compare need hospitalization hospitalize group higher seroprevalence rate cytomegalovirus herpes simplex virus find may influence difference demographic composition two group raise hypothesis may test future study use alanine scan mutagenesis precisely map distinct epitope across entire sars cov proteome likely target neutralize antibody one cross reactive antibody epitope previously suggest neutralize exist pre covid era sample could affect severity covid conclusion present highly detail view epitope landscape within sars cov proteome knowledge may use produce diagnostics improve specificity provide step stone isolation functional dissection neutralize antibody antibody might exacerbate patient outcome antibody dependent enhancement immune distraction study reveal notable correlation covid severity viral exposure history overall strength antibody response past infection find likely influence demographic covariates generate hypothesis may test larger patient cohort match age gender race demographic variable sars cov epitope map virscan detect antibody sars cov covid patient severe mild disease heatmap color represent strength antibody response sample column protein row leave peptide row right virscan reveal precise position epitope map onto structure spike protein examination sars cov seasonal coronavirus sequence conservation explain epitope cross reactivity ala asp e glu f phe ile k lys l leu n asn p pro q gln r arg ser thr v val w trp tyr understand humoral response severe acute respiratory syndrome coronavirus sars cov critical improve diagnostics therapeutic vaccine deep serological profile coronavirus disease covid patient pre covid era control use virscan reveal epitope sars cov proteome include epitope likely recognize neutralize antibody preexist antibody control recognize sars cov orf whereas covid patient antibody primarily recognize spike protein nucleoprotein machine learn model train virscan data predict sars cov exposure history sensitivity specificity rapid luminex base diagnostic develop discriminatory sars cov peptide individual severe covid exhibit stronger broader sars cov response weaker antibody response prior infection higher incidence cytomegalovirus herpes simplex virus possibly influence demographic covariates among hospitalize patient male produce stronger sars cov antibody response female,applications,2020
