document_id,title,abstract,clean_text,label,year
cb349a7647eaa37f5806b435e0f8e2918980a9a2,American Gut: an Open Platform for Citizen Science Microbiome Research,"We show that a citizen science, self-selected cohort shipping samples through the mail at room temperature recaptures many known microbiome results from clinically collected cohorts and reveals new ones. Of particular interest is integrating n = 1 study data with the population data, showing that the extent of microbiome change after events such as surgery can exceed differences between distinct environmental biomes, and the effect of diverse plants in the diet, which we confirm with untargeted metabolomics on hundreds of samples. ABSTRACT Although much work has linked the human microbiome to specific phenotypes and lifestyle variables, data from different projects have been challenging to integrate and the extent of microbial and molecular diversity in human stool remains unknown. Using standardized protocols from the Earth Microbiome Project and sample contributions from over 10,000 citizen-scientists, together with an open research network, we compare human microbiome specimens primarily from the United States, United Kingdom, and Australia to one another and to environmental samples. Our results show an unexpected range of beta-diversity in human stool microbiomes compared to environmental samples; demonstrate the utility of procedures for removing the effects of overgrowth during room-temperature shipping for revealing phenotype correlations; uncover new molecules and kinds of molecular communities in the human stool metabolome; and examine emergent associations among the microbiome, metabolome, and the diversity of plants that are consumed (rather than relying on reductive categorical variables such as veganism, which have little or no explanatory power). We also demonstrate the utility of the living data resource and cross-cohort comparison to confirm existing associations between the microbiome and psychiatric illness and to reveal the extent of microbiome change within one individual during surgery, providing a paradigm for open microbiome research and education. IMPORTANCE We show that a citizen science, self-selected cohort shipping samples through the mail at room temperature recaptures many known microbiome results from clinically collected cohorts and reveals new ones. Of particular interest is integrating n = 1 study data with the population data, showing that the extent of microbiome change after events such as surgery can exceed differences between distinct environmental biomes, and the effect of diverse plants in the diet, which we confirm with untargeted metabolomics on hundreds of samples.",show citizen science self select cohort ship sample mail room temperature recapture many know microbiome result clinically collect cohort reveal new one particular interest integrate n study data population data show extent microbiome change event surgery exceed difference distinct environmental biome effect diverse plant diet confirm untargeted metabolomics hundred sample abstract although much work link human microbiome specific phenotype lifestyle variable data different project challenge integrate extent microbial molecular diversity human stool remain unknown use standardize protocol earth microbiome project sample contribution citizen scientist together open research network compare human microbiome specimen primarily unite state unite kingdom australia one another environmental sample result show unexpected range beta diversity human stool microbiomes compare environmental sample demonstrate utility procedure remove effect overgrowth room temperature ship reveal phenotype correlation uncover new molecule kind molecular community human stool metabolome examine emergent association among microbiome metabolome diversity plant consume rather rely reductive categorical variable veganism little explanatory power also demonstrate utility live data resource cross cohort comparison confirm exist association microbiome psychiatric illness reveal extent microbiome change within one individual surgery provide paradigm open microbiome research education importance show citizen science self select cohort ship sample mail room temperature recapture many know microbiome result clinically collect cohort reveal new one particular interest integrate n study data population data show extent microbiome change event surgery exceed difference distinct environmental biome effect diverse plant diet confirm untargeted metabolomics hundred sample,methods_models,2018
6ddd4c2ff072712744a7de4b4c6855d61fbe4928,Scalable Open Science Approach for Mutation Calling of Tumor Exomes Using Multiple Genomic Pipelines.,"The Cancer Genome Atlas (TCGA) cancer genomics dataset includes over 10,000 tumor-normal exome pairs across 33 different cancer types, in total >400 TB of raw data files requiring analysis. Here we describe the Multi-Center Mutation Calling in Multiple Cancers project, our effort to generate a comprehensive encyclopedia of somatic mutation calls for the TCGA data to enable robust cross-tumor-type analyses. Our approach accounts for variance and batch effects introduced by the rapid advancement of DNA extraction, hybridization-capture, sequencing, and analysis methods over time. We present best practices for applying an ensemble of seven mutation-calling algorithms with scoring and artifact filtering. The dataset created by this analysis includes 3.5 million somatic variants and forms the basis for PanCan Atlas papers. The results have been made available to the research community along with the methods used to generate them. This project is the result of collaboration from a number of institutes and demonstrates how team science drives extremely large genomics projects.",cancer genome atlas tcga cancer genomics dataset include tumor normal exome pair across different cancer type total tb raw data file require analysis describe multi center mutation call multiple cancer project effort generate comprehensive encyclopedia somatic mutation call tcga data enable robust cross tumor type analysis approach account variance batch effect introduce rapid advancement dna extraction hybridization capture sequence analysis method time present best practice apply ensemble seven mutation call algorithm score artifact filter dataset create analysis include million somatic variant form basis pancan atlas paper result make available research community along method use generate project result collaboration number institute demonstrate team science drive extremely large genomics project,methods_models,2018
e4343f50a6112ab44e7de196de620dd376c2cb25,Applying the Model-Comparison Approach to Test Specific Research Hypotheses in Psychophysical Research Using the Palamedes Toolbox,"In the social sciences it is common practice to test specific theoretically motivated research hypotheses using formal statistical procedures. Typically, students in these disciplines are trained in such methods starting at an early stage in their academic tenure. On the other hand, in psychophysical research, where parameter estimates are generally obtained using a maximum-likelihood (ML) criterion and data do not lend themselves well to the least-squares methods taught in introductory courses, it is relatively uncommon to see formal model comparisons performed. Rather, it is common practice to estimate the parameters of interest (e.g., detection thresholds) and their standard errors individually across the different experimental conditions and to ‘eyeball’ whether the observed pattern of parameter estimates supports or contradicts some proposed hypothesis. We believe that this is at least in part due to a lack of training in the proper methodology as well as a lack of available software to perform such model comparisons when ML estimators are used. We introduce here a relatively new toolbox of Matlab routines called Palamedes which allows users to perform sophisticated model comparisons. In Palamedes, we implement the model-comparison approach to hypothesis testing. This approach allows researchers considerable flexibility in targeting specific research hypotheses. We discuss in a non-technical manner how this method can be used to perform statistical model comparisons when ML estimators are used. With Palamedes we hope to make sophisticated statistical model comparisons available to researchers who may not have the statistical background or the programming skills to perform such model comparisons from scratch. Note that while Palamedes is specifically geared toward psychophysical data, the core ideas behind the model-comparison approach that our paper discusses generalize to any field in which statistical hypotheses are tested.",social science common practice test specific theoretically motivate research hypothesis use formal statistical procedure typically student discipline train method start early stage academic tenure hand psychophysical research parameter estimate generally obtain use maximum likelihood ml criterion data lend well least square method teach introductory course relatively uncommon see formal model comparison perform rather common practice estimate parameter interest e g detection threshold standard error individually across different experimental condition eyeball whether observe pattern parameter estimate support contradict propose hypothesis believe least part due lack train proper methodology well lack available software perform model comparison ml estimator use introduce relatively new toolbox matlab routine call palamedes allow user perform sophisticate model comparison palamedes implement model comparison approach hypothesis test approach allow researcher considerable flexibility target specific research hypothesis discus non technical manner method use perform statistical model comparison ml estimator use palamedes hope make sophisticate statistical model comparison available researcher may statistical background program skill perform model comparison scratch note palamedes specifically gear toward psychophysical data core idea behind model comparison approach paper discuss generalize field statistical hypothesis test,methods_models,2018
f567f5a4a57509c2288f510d6703212ce8499527,The Ames Stereo Pipeline: NASA's Open Source Software for Deriving and Processing Terrain Data,"The NASA Ames Stereo Pipeline is a suite of free and open source automated geodesy and stereogrammetry tools designed for processing stereo images captured from satellites (around Earth and other planets), robotic rovers, aerial cameras, and historical images, with and without accurate camera pose information. It produces cartographic products, including digital terrain models, ortho‐projected images, 3‐D models, and bundle‐adjusted networks of cameras. Ames Stereo Pipeline's data products are suitable for science analysis, mission planning, and public outreach.",nasa ames stereo pipeline suite free open source automate geodesy stereogrammetry tool design process stereo image capture satellite around earth planet robotic rover aerial camera historical image without accurate camera pose information produce cartographic product include digital terrain model ortho project image model bundle adjust network camera ames stereo pipeline data product suitable science analysis mission plan public outreach,methods_models,2018
a0de2b1a52c2266cdd16fca84f8bbe5a9d14405a,The DREAMS core package of interventions: A comprehensive approach to preventing HIV among adolescent girls and young women,"In sub-Saharan Africa, adolescent girls and young women (AGYW) are 5 to 14 times more likely to be infected with HIV than their male peers. Every day, more than 750 AGYW are infected with HIV. Many factors make girls and young women particularly vulnerable to HIV, including gender-based violence, exclusion from economic opportunities, and a lack of access to secondary school. The President’s Emergency Plan for AIDS Relief (PEPFAR) is dedicating significant resources through the Determined, Resilient, Empowered, AIDS-free, Mentored, and Safe (DREAMS) partnership to impact the lives of women and girls based on PEPFAR’s mission to help countries achieve epidemic control of HIV/AIDS. The data show that new HIV infections must be reduced in AGYW, or the global community risks losing the extensive progress made towards reaching epidemic control. With support from PEPFAR and private sector partners—the Bill & Melinda Gates Foundation, Gilead Sciences, Girl Effect, Johnson & Johnson and ViiV Healthcare, DREAMS works together with partner governments to deliver a core package of interventions that combines evidence-based approaches that go beyond the health sector, addressing the structural drivers that directly and indirectly increase girls’ HIV risk. Not only is DREAMS an effort to reduce new HIV infections, but it aims to reduce other critical vulnerabilities such as gender-based violence. When girls and young women thrive, the effects are felt throughout their families, communities and countries.",sub saharan africa adolescent girl young woman agyw time likely infect hiv male peer every day agyw infect hiv many factor make girl young woman particularly vulnerable hiv include gender base violence exclusion economic opportunity lack access secondary school president emergency plan aid relief pepfar dedicate significant resource determine resilient empower aid free mentor safe dream partnership impact life woman girl base pepfar mission help country achieve epidemic control hiv aid data show new hiv infection must reduce agyw global community risk lose extensive progress make towards reach epidemic control support pepfar private sector partner bill melinda gate foundation gilead science girl effect johnson johnson viiv healthcare dream work together partner government deliver core package intervention combine evidence base approach go beyond health sector address structural driver directly indirectly increase girl hiv risk dream effort reduce new hiv infection aim reduce critical vulnerability gender base violence girl young woman thrive effect felt throughout family community country,methods_models,2018
e591fbe01080beb63d4efd044176e6e93dbe472e,More than tools? Making sense of the ongoing digitizations of higher education,"Introduction In times of hype surrounding the ‘Internet of Things’, ‘blockchain universities’, ‘learning analytics’ and the like, this special issue of the International Journal of Educational Technology in Higher Education starts from a simple proposition – how might we develop critical perspectives and alternative visions of technology in higher education? Our initial call resulted in the six articles that you find attached. These were written from a diversity of perspectives, and therefore address a range of concerns and approaches. We have articles that consider the implications of neuroscience for understanding educational technology, phenomenological reinterpretations of the ‘affordances’ of technology, and the politics of ‘big data’ in higher education reform. Elsewhere is a reassessment of mobile learning, a critical exploration of the ideological underpinnings of national digital strategies, and pedagogical analysis of personalized and adaptive learning. Contributions have been made by authors across Europe working in psychology and the behavioural sciences, social sciences, education research, communications and the arts. We feel confident that this collection meets our initial intention of problematizing the claims and assumptions surrounding higher education in the digital age. This is an interesting and insightful set of arguments, offering a useful counterpoint to articles featured elsewhere in the journal. While we are happy to have amassed this broad range of critical perspectives, we are not particularly surprised by the range of articles we received. The past 5 years has seen a sharp increase in scholars expressing critical views of education and technology. It is no longer an oddity to encounter challenging questions of the social, cultural, political and economic connotations of digital technology use in higher education. Nowadays, someone who problematizes the digitization of universities does not instantly draw accusations of being dystopian or simply out-of-touch. After decades of critical voices in education technology being simply ignored, or marginalized and maligned, it is now reassuring to be able to claim that there is nothing distinct about the articles that we present in this issue. However, this is not to say that these articles do not deserve our close attention. As one might hope, this is a collection of interesting contributions that raises a range of important ideas. As such, we have decided not to waste our ‘editorial’",introduction time hype surround internet thing blockchain university learn analytics like special issue international journal educational technology higher education start simple proposition might develop critical perspective alternative vision technology higher education initial call result six article find attach write diversity perspective therefore address range concern approach article consider implication neuroscience understand educational technology phenomenological reinterpretation affordances technology politics big data higher education reform elsewhere reassessment mobile learn critical exploration ideological underpinnings national digital strategy pedagogical analysis personalize adaptive learn contribution make author across europe work psychology behavioural science social science education research communication art feel confident collection meet initial intention problematizing claim assumption surround higher education digital age interest insightful set argument offer useful counterpoint article feature elsewhere journal happy amass broad range critical perspective particularly surprise range article receive past year see sharp increase scholar express critical view education technology longer oddity encounter challenge question social cultural political economic connotation digital technology use higher education nowadays someone problematizes digitization university instantly draw accusation dystopian simply touch decade critical voice education technology simply ignore marginalize malign reassure able claim nothing distinct article present issue however say article deserve close attention one might hope collection interest contribution raise range important idea decide waste editorial,methods_models,2018
